Title,Price,Rating
NORTHYARD Men's Athletic Running T-Shirts Quick Dry Workout Shirts Short-Sleeve Sports Gym Tee Tops Performance Activewear,$21.99,4.5 out of 5 stars
Data Analyst Definition Data Analysis Distressed T-Shirt,$9.99,Previous page
Got Data? Data Analyst Programmer Accountant Distressed T-Shirt,$9.99,Previous page
Talk Data To Me Data Analyst Programmer Data Analysis T-Shirt,$9.99,Previous page
KLIEGOU Men's T-Shirts - Premium Cotton Crew Neck Tees S - 4XL,$24.99,4.2 out of 5 stars
AUTOMET Womens Tops Casual Dressy Basic T Shirts Loose Fit Crewneck Cap Sleeve Tee Summer Outfits 2024,$14.99,4.4 out of 5 stars
"Gildan Unisex-Adult Softstyle Cotton T-Shirt, Style G64000, Multipack",$13.51,4.5 out of 5 stars
"Gildan Unisex-Adult Ultra Cotton T-Shirt, Style G2000, Multipack",$43.86,4.5 out of 5 stars
Data Analyst First Coffee Then Data T-Shirt,,Previous page
Data Communications Analyst AF - A Soft & Comfortable Men's T-Shirt,,5.0 out of 5 stars
Got Data? Data Analyst Programmer Accountant T-Shirt,$9.99,Previous page
Collecting Data Is My Cardio Data Analyst Programmer T-Shirt,,Previous page
Data Analyst T Shirt Funny Gift for Data Analyst Graduate Career Professional Data Analyst Spreadsheet Unisex Tee,,5.0 out of 5 stars
Maintenance Data Analyst AF - A Soft & Comfortable Men's T-Shirt,,5.0 out of 5 stars
"In the World of Finance, a Good Financial Analyst T-Shirt",$19.99,Previous page
Data Analyst Data Scientist Data Analysis T-Shirt,,Previous page
Seize The Data T Shirt Funny Gift for Computer Scientist Analyst Engineer Coder Geek - Unisex Tee,,Previous page
Data Analyst We Do Precision Guesswork T-Shirt,,Previous page
Data Analyst I Back It Up With Data Programmer Data Analysis T-Shirt,$17.49,Previous page
Data Opinion Big Data Engineer Science Data Analyst Long Sleeve T-Shirt,,Previous page
KLIEGOU Men's T-Shirts - Premium Cotton Crew Neck Tees S - 4XL,$24.99,4.2 out of 5 stars
"Gildan Unisex-Adult Ultra Cotton T-Shirt, Style G2000, Multipack",$39.99,4.5 out of 5 stars
"Gildan Unisex-Adult Heavy Cotton T-Shirt, Style G5000, Multipack",$9.99,4.5 out of 5 stars
"Gildan Unisex-Adult Softstyle Cotton T-Shirt, Style G64000, Multipack",$13.08,4.5 out of 5 stars
Data Analyst Funny Nutritional Facts - For Data Analysts Premium T-Shirt,$31.99,Previous page
Talk Data To Me Big Data Engineer Science Data Analyst Long Sleeve T-Shirt,,Previous page
Data Hangover Definition Data Analyst Programmer Distressed T-Shirt,,Previous page
Data Driven Data Analyst Programmer Accountant Distressed T-Shirt,,Previous page
YUCOLEN Women's T-Shirts 1/2 Sleeve Short Sleeve Cotton Summer Tops 2024 Soft Crew Neck Fashion Fitted Basic Tee,$18.98,4.3 out of 5 stars
"Gildan Unisex-Adult Ultra Cotton Long Sleeve T-Shirt, Style G2400, Multipack",$53.99,4.5 out of 5 stars
"Gildan Mens Cotton Stretch T-Shirts, Multipack",$23.97,4.5 out of 5 stars
AUTOMET Womens Tops Casual Dressy Basic T Shirts Loose Fit Crewneck Cap Sleeve Tee Summer Outfits 2024,$14.99,4.4 out of 5 stars
Happy Data Analyst Coffee Data Analysis Distressed T-Shirt,,Previous page
In Data We Trust Data Analyst Programmer Accountant Vintage T-Shirt,$9.99,Previous page
Collecting Data Is My Cardio Data Analyst Programmer Grunge T-Shirt,,Previous page
"Funny Statistics definition, funny statistician Sayings DATA T-Shirt",$15.99,5.0 out of 5 stars
"Gildan Women's Softstyle Cotton T-Shirt, Style G64000L, Multipack",$11.95,3.9 out of 5 stars
EADINVE Womens Tshirts V Neck Short Sleeve Buttons Tops Tee Solid Color Blouse Loose Fit,$19.98,4.2 out of 5 stars
Men's Ultra Soft Bamboo Viscose T-Shirt Curve Hem Lightweight Cooling Short/Long Sleeve Casual Basic Tee Shirt,$19.55,4.6 out of 5 stars
Data Analyst We Do Precision Guesswork Long Sleeve T-Shirt,,Previous page
Womens Talk Data To Me Big Data Engineer Science Data Analyst V-Neck T-Shirt,,Previous page
Data Analyst Just A Girl Who Likes Data Distressed T-Shirt,,Previous page
Data Analyst Introverted But Willing To Discuss Data Grunge T-Shirt,,Previous page
"Data Analyst Because Badass Miracle Worker Isn't an Official Job Title T-Shirt, Data Shirt, Data Analyst Gift, Science Gift",,5.0 out of 5 stars
Debugging Expert Shirt Computer Coder Gift for Computer Programmer Ethical Hacker T Shirt Data Analyst Unisex Tee,,5.0 out of 5 stars
Statistician shirt Show me the data men women Analyst Geek T-Shirt,$14.90,Previous page
I love data Science Scientist Analysis Geek Analyst T-Shirt,,Previous page
Womens SQL Data Analyst Xmas Job Cute Christmas V-Neck T-Shirt,,Previous page
Womens Data Analyst We Do Precision Guesswork V-Neck T-Shirt,$19.99,Previous page
Womens Data Analyst We Do Precision Guesswork V-Neck T-Shirt,$19.99,Previous page
Look At Me Becoming A Maintenance Data Analyst And Shit! - A Soft & Comfortable Men's T-Shirt,,5.0 out of 5 stars
Data Base Design Analyst AF - A Soft & Comfortable Men's T-Shirt,,5.0 out of 5 stars
Data Analyst Evolution Data Science Programming Programmer T-Shirt,,Previous page
Look At Me Becoming A Data Base Design Analyst And Shit! - A Soft & Comfortable Men's T-Shirt,,5.0 out of 5 stars
Statistician Keeps My Life Together Data Analyst Sayings Long Sleeve T-Shirt,$25.99,Previous page
Data Analyst Torture The Data CPA Accounting Gift Accountant T-Shirt,,Previous page
I'm A Maintenance Data Analyst. I Got This. I Think. - A Soft & Comfortable Men's T-Shirt,$27.55,Previous page
"Womens Coffee And Analyze Data - Data Scientist, Funny Data Analyst V-Neck T-Shirt",,Previous page
Look At Me Becoming A Data Communications Analyst And Shit! - A Soft & Comfortable Men's T-Shirt,,5.0 out of 5 stars
I'm A Data Communications Analyst. I Got This. I Think. - A Soft & Comfortable Men's T-Shirt,,5.0 out of 5 stars
I'm A Data Base Design Analyst. I Got This. I Think. - A Soft & Comfortable Men's T-Shirt,,5.0 out of 5 stars
Womens Data Scientist Nutrition Facts Data Science V-Neck T-Shirt,$9.99,Previous page
Data Analyst Gift - Data Analysis Shirt - Data Scientist Present - Funny Data Science - Just Freaking Love Data - Unisex Tee,,Previous page
Data Analyst Gift - Data Analysis Shirt - Data Scientist Present - Funny Data Science - Let's Analyze Some Data - Unisex Tee,$9.99,Previous page
KLIEGOU Men's T-Shirts - Premium Cotton Crew Neck Tees S - 4XL,$24.99,4.2 out of 5 stars
"Gildan Unisex-Adult Ultra Cotton T-Shirt, Style G2000, Multipack",$39.99,4.5 out of 5 stars
"Gildan Unisex-Adult Heavy Cotton T-Shirt, Style G5000, Multipack",$34.99,4.5 out of 5 stars
"Gildan Unisex-Adult Softstyle Cotton T-Shirt, Style G64000, Multipack",$11.70,4.5 out of 5 stars
"Gildan Adult DryBlend Workwear T-Shirts with Pocket, 2-Pack",$17.64,4.6 out of 5 stars
